{
  "deadLetterRef": "dlq_txn_copy_001_design-agent_5",
  "sourceEventTransactionId": "txn_copy_001",
  "sourceEventKey": "copy.draft_created",
  "consumerAgent": "design-agent",
  "attempt": 5,
  "terminalReason": "retry_exhausted",
  "terminalErrorCode": "RETRY_ATTEMPTS_EXHAUSTED",
  "rootCause": {
    "code": "PROVIDER_TIMEOUT",
    "message": "Provider did not acknowledge the delivery before timeout.",
    "retryable": true
  },
  "deadLetteredAt": "2026-09-21T20:00:00Z",
  "humanEscalationRequired": true,
  "reprocessing": {
    "automaticAllowed": false,
    "authorizationRevalidationRequired": true,
    "preservesSourceLink": true
  },
  "evidenceRefs": [
    "audit://outbox/txn_copy_001/attempt/5"
  ]
}
